,Unnamed: 0,Caption,Brief Description,Algorithm,Jurisdiction,Application Areas,Cause of Action,Issues,Date Action Filed,New Activity,Link,Status,sig_summary,ext_summary,recent_activity,Year Filed,Status_Cat
93,93,People v. Wakefield,"Acknowledging the intersection of due process and scientific advancements, the highest court affirmed a trial court finding that TrueAllele Casework System, the DNA software program used to identify defendant in a murder scene, was generally accepted by the scientific community and did not violate defendant's right to face accusers by not having access to the source code by differentiating DNA collection vs. DNA probability",TrueAllele,State: New York,"Constitutional Law, Criminal Justice, DNA Analysis, Sentencing","Biometric Information Privacy Act, Conviction Challenge, Due Process, Evidence, 6th Amendment","Admissibility, Transparency/Trade Secrecy, Unreliability, Reliability, Confrontation Clause",,8/15/2019,https://blogs.gwu.edu/law-eti/?page_id=10&pid=54,Inactive,"The two issues relating to algorithms in this case was the scientific validity of TrueAllele and the defendant's right to face his accuser as an algorithm. First, the court notes that TrueAllele uses the MCMC algorithm to ""solve high dimension calculus problems that would be impossible or impractical without a computer so as to identify all possibilities, not just the maximum possibility."" At the trial court Frye hearing, expert witness testified that TrueAllele uses the Markov Chain Monte Carlo algorithm give probabilities of all different possibilities, as it proposes the possibilities for different genotypes based on the lab generated data from the DNA electropherogram rather than the traditional interpretation by a person. The expert witness added that ""after objectively generating all genotype possibilities, TrueAllele answers the question of ""how much more the suspect matches the evidence [than] a random person would,"" and the answer takes the form of a likelihood ratio."""" For the second issue of the right to face accuser violated because he was not granted access to the source code. The court grappled with the intersection of due process and science. The court differentiates that the DNA extraction done by state police traditionally go through combined probability inclusion to simplify the DNA for human observation whereas TrueAllele is a fully-continuous probabilistic systems uses all available data to look at more patterns. There is human interaction with True Allele as it tells the software what to download and what questions to ask when running the data.","Summary of Facts and Activity to DateThe defendant was brought on murder and robbery charges in Schenectady County. After the murder victim was found by a mental health case worker after not responding, the police published request for information. A friend of the defendant informed police that the defendant had admitted to murdering the victim, leading to the defendant's arrest. The police performed a nasal swab and sent the DNA to a private lab, Cybergenetics, hat used TrueAllele for testing. At the trial court, the defendant moved to exclude all evidence regarding TrueAllele until it was established that it was recognized by the scientific community in a Frye hearing. The trial court granted the Frye hearing and heard testimony from Cybergenetics' founder and chief scientist in July of 2014.  The court allowed the DNA probability into evidence, a jury trial found the defendant guilty of first degree murder and first degree robbery, anhd he was sentenced for life in prison without parole. The defendant appealed. In affirming the trial court's finding under the Frye protocol of hearing expert testimony"" based on a scientific principle or procedure which has been sufficiently established to have gained general acceptance in the particular field in which it belongs."" TrueAllele has gone through 25 validation studies and had been published in six forensic science journals, has been recognized by The DNA Subcommittee of the New York State Forensic Science Commission, and has used it to identify remains from 9/11. Defendant's other claim on appeal is that the DNA evidence does not establsih robbery, however TrueAllele's probability the defendant's DNA on the missing items was categorically more probable than coincidental. Even viewing the DNA evidence in a neutral light, the addition of witness testimony convinced the appellate court to affirm. The defendant's third claim on appeal is that the defendant did not have the right ot face his accuser against TrueAllele. Unlike traditional DNA analysis that does not use all the data extracted and relies on a human analyst, True Allele uses all the data to come up with probabilities through a calculus algorithm. The source code is protected by trade secret as only two people know it, and the source code was designed with a high level of mathematical understanding.  The court found that Cybergenetics was acting to assist law enforcement, the report of comparing the defendant's DNA to the DNA on the crime scene was testimonial in nature and thus True Allele is not a declarant and affirmed the trial court. The concurring judge said it was unnecessary to decide this issue because the defendant did not move for the source code to be disclosed post Frye Hearing.",Highest Court Opinion,,Inactive
94,94,People v. Younglove,,COMPAS,State: Michigan,"Criminal Justice, Sentencing",,,,,https://blogs.gwu.edu/law-eti/?page_id=10&pid=37,,,"Summary of Facts and Activity to DateThis appeal about COMPAS is brought relating to: PEOPLE OF THE STATE OF MICHIGAN, Plaintiff-Appellee, v. ERIN RENEE YOUNGLOVE, Defendant-Appellant. PEOPLE OF THE STATE OF MICHIGAN, Plaintiff-Appellee, v. DARRELL WAYNE HEGLER, Defendant-Appellant. PEOPLE OF THE STATE OF MICHIGAN, Plaintiff-Appellee, v. LUKE MATTHEW WILSON, Defendant-Appellant. PEOPLE OF THE STATE OF MICHIGAN, Plaintiff-Appellee, v. FREDERICK ANTHONY BRADFORD, Defendant-Appellant.",,,Not specified
95,95,Rana v. Amazon et al,"A lawsuit against Amazon for vicarious liability of a delivery truck driver Williams, the contracting delivery company Harper Logistics and the delivery business’s insurance provider, Old Republic Insurance Co. for a car crash by Amazon Delivery Driver that left plainitff paralyzed.",,State: Georgia,Personal Injury,"Negligence, Vicarious Liability",Misuse of AI,2021-06-25,,https://blogs.gwu.edu/law-eti/?page_id=10&pid=71,Active,"Although have been over 100 lawsuits filed against Amazon Logistics in the last year for crashes by delivery vans, this case is the most severe in its argument of control by Amazon rather than the contracted delivery companies and insurance providers. The outcome of this case will influence future cases against Amazon, and could result in the public exposure of Amazon's algorithms. By demonstrating managerial ownership of Harper Logistics rather than Amazon merely being a customer, plaintiff hopes to show Amazon's algorithm controlled the driver route and speed, and therefore is vicariously liable for negligently making drivers work unreasonable shifts.","Summary of Facts and Activity to DateOn March 15, 2021, plaintiff was in a car accident in Atlanta when an Amazon Delivery truck hit their car. Plaintiff suffered spine and brain injuries, on a ventilator and now in a wheelchair. Plainitiff filed complaint in state Atlanta court in June 2021 against Amazon, the delivery driver Williams, the contractor delivery truck company Harper Logistics, and the delivery company's insurance provider. Through the theory of vicarious liability, plaintiff argues that Amazon's algorithms controls the whole delivery operations of the delivery truck drivers and trucks to deliver all the packages in a speedy manner. The arguments for vicairous liablity are that Amazon controls the route, the hours, the number of packages, and requires drivers to wear the Amazon logo.",,2021.0,Active
96,96,"Renderos v. Clearview AI, Inc.","Plaintiffs initially filed suit against Clearview in County of Alameda Superior Court in California on March 9, 2021. Clearview filed an action to remove the matter to the Northern District of California (N.D. Cal.). This case was transferred to N.D. Ill. on Oct. 5, 2021, to be joined with the existing MDL, In re Clearview.",Clearview,California,"Biometric Data, Facial Recognition, Privacy","Right to Privacy, Right to Publicity","Facial Recognition, Law Enforcement",2021-03-14,10/5/2021,https://blogs.gwu.edu/law-eti/?page_id=10&pid=73,Inactive,"Renderos was the first case against Clearview in California.  The plaintiffs also filed claims against police departments in California for uploading photographs of plaintiffs and other California citizens to the Clearview database, despite the City of Alameda (where one of the police departments resided) banning facial recognition in 2019.  The Renderos claims were primarily focused on the use of facial recognition for speech chilling and police action, rather than solely Clearview's acquisition of biometric data.The Renderos plaintiffs, resting on their claims against the California municipal defendants, attempted to remain in California state court rather than be transferred to the MDL in N.D. Ill.  However, the Judicial Panel on Multidistrict Litigation determined that the issues in the case were substantially similar to the other cases in In re Clearview.  Although the arguments were different, the issues regarding collection, distribution, and profiting off of citizens' biometric data were the same.  The case was transferred to N.D. Ill. and combined with In re Clearview on Oct. 5, 2021.","Summary of Facts and Activity to DateRenderos et al. filed suit in California Superior Court against Clearview and the Alameda County District Attorney, Alameda Police Department, El Segundo Police Department, Antioch Police Department, and anonymous police officers on Apr. 22, 2021.Clearview filed a motion June 14, 2021, to remove the case to N.D. Cal., arguing that the diversity and amount in controversy requirements had both been met.On June 21, 2021, the United States Judicial Panel on Multidistrict Litigation filed a conditional transfer order to transfer this case to N.D. Ill. and join it with the other cases in In re Clearview.  Plaintiffs requested that the panel vacate the order on the grounds that their case involved California municipal defendants and was centered on fear of police action, rather than loss of privacy.On Oct. 5th, 2021, the United States Judicial Panel on Multidistrict Litigation upheld the conditional transfer order and ordered the transfer to N.D. Ill. and consolidation with In re Clearview.",10/05/2021,2021.0,Inactive
97,97,"Roberson v. Clearview AI, Inc.",,Clearview,Federal: E.D. Va.; Transferred to Federal: US Dist Ct. S.D. New York; Transferred to US Dist. Ct. N.D. Illinois,Facial Recognition,,Privacy,2020-02-03,1/12/2021,https://blogs.gwu.edu/law-eti/?page_id=10&pid=33,Active,"Chronologically, this was the second case filed of the nine consolidated into In Re Clearview. It is the only case not filed in either Illinois or New York, and it was brought under the Virginia Code and the Virginia Computer Crimes Act. Unlike similar cases, Roberson only brought claims against Clearview and not its founders (and obviously not the Illinois company who acted as a third party contractor).","Summary of Facts and Activity to DateRoberson filed complaint on February 3, 2020 on behalf of a Virginia class whose photographs were unlawfully used by Clearview under the Virginia Computer Crimes Act.The Virginia Code provides statutory damages for ""any person whose name, portrait, or picture is used without having first obtained the written consent of such person . . . for the purposes of trade"" and the Virginia Computer Crimes Act provides a private right of action regardless of any malicious intent. The specific claim against Clearview is obtaining the property of another without consent from the data scraping online, and then making copies of the data into their database, and third because the information collected is identifying personal information and then used trickery or deception by not obtaining consent.Clearview filed its motion to transfer or dismiss in March.Court transferred the case to SDNY on May 13, 2020, which the Virginia court granted.On May 29, the SDNY Court denied Mutnick's motion to intervene and dismiss or transfer the cases to Illinois, as eight federal cases had been filed by May, six of which had been brought or transferred to New York.",MDL Transfer,2020.0,Active
98,98,Rodriguez v. Massachusetts Parole Board,"Mr. Rodriguez, an incarcerated plaintiff in Massachusetts, was consistently denied parole based on a predictive algorithm that gave him a high-risk score for reoffense. Rodriguez sued the Massachusetts Parole Board, arguing that the use of this algorithm failed to consider relevant factors and violated his due process rights. The Supreme Judicial Court of Massachusetts held that the board had appropriately considered the relevant factors and affirmed its decision to deny parole.",LS/CMI,Massachusetts Supreme Judicial Court for the Commonwealth,"Civil Rights, Criminal Justice",5th Amendment,"Individualized Assessment, Misuse of AI, Transparency/Trade Secrecy",2022-11-23,3/7/2022,https://blogs.gwu.edu/law-eti/?page_id=10&pid=79,Inactive: Judgment for D,"Mr. Rodriguez, an incarcerated plaintiff in Massachusetts, was consistently denied parole based on a predictive algorithm that gave him a high-risk score for reoffense. Rodriguez sued the Massachusetts Parole Board, arguing that the use of this algorithm failed to consider relevant factors and violated his due process rights.","Summary of Facts and Activity to DateThe Massachusetts Parole Board (“MPB”) has started using a predictive analytical tool from a third-party contractor. The MPB uses a tool called the Level of Service/Case Management Inventory (“LS/CMI”) to generate risk scores that purport to predict how likely a parole applicant is to end up back in prison. Mr. Jose Rodriguez, has been consistently denied parole based on the high risk score that LS/CMI gives him. Mr. Rodriguez is challenging the Parole Board’s use of LS/CMI to give him a high risk score, and the Parole Board’s refusal to share any useful information about how his score was calculated.",Opinion Issued,2022.0,Decided
99,99,Sancton v. OpenAI Inc.,"Nonfiction author Julian Sancton files a copyright infringement suit against OpenAI and Microsoft, proposing a class action involving all authors of nonfiction works registered at the Copyright Office that have received ISBNs or were published in academic journals and that were copied as training data for ChatGPT.",ChatGPT,Federal: US Dist. Ct. S.D.N.Y.,Generative AI,Copyright Infringement,"Copyright Infringement, Fair Use",2023-11-21,11/22/2023,https://blogs.gwu.edu/law-eti/?page_id=10&pid=105,Active,"This is the first lawsuit involving ChatGPT that names Microsoft, on a theory of contributory infringement, as well as OpenAI, on a theory of direct copyright infringement.","Summary of Facts and Activity to DateComplaint filed November 21, 2023; case referred to Judge Sidney Stein as possibly related to Authors Guild v. OpenAi.",Case referred to Judge Sidney Stein,2023.0,Active
100,100,"Sevatec, Inc. v. Ayyar",The court allowed expert testimony at trial to understand complex evidence related to artificial intelligence,,State: Fairfax County of Virginia,Corporate Law,"Evidence, Fiduciary Duty",Role of Expert Testimony,2018-10-09,,https://blogs.gwu.edu/law-eti/?page_id=10&pid=57,Active,"The two issues for expert testimony concerned (1) explaining complex artificial intelligence to the jury and (2) explaining the corporate business opportunity. For the complex issues, Hermus was an appropriate expert witness with 20 years of experience in information technology and could explain data analytics, artificial intelligence, and machine learning to the triers of fact. His background gave him ""knowledge beyond that of persons of common knowledge and ordinary experience.""","Summary of Facts and Activity to DatePlaintiff is a corporation, Sevatec, who provides ""data analytics"" solutions involving machine learning, artificial intelligence, and open source technologies. Sevatec brought suit in Fall 2018 against its former President and CEO Ayyar and Chief Technology Officer Bangalore. Sevatec alleges Ayyar and Bangalore ""conspired to develop a new technology solution involving artificial intelligence and data analytics prior to their departures and formed Defendant Percipient.AI, Inc. whose flagship offering is the technology solution developed while in the employ of Sevatec."" In March 2019, Sevatec assigned expert witness Hermus who is a technology specialist to testify on their usurpation of business from Sevatec. Defendants moved to exclude his testimony for three reasons: (1) Hermus's opinions  will mislead the jury about Virginia law by using a Delaware test, (2) ""Hermus's opinions will invade the province of the jury because they are rudimental and will not assist the jury in resolving any facts  at issue,"" and (3) Sevatec failed to identify all the documents and information relied upon by Hermus in his expert disclosure. On June 3, 2019, the court denied this motion in limine. For the first contention, the court compares the Usurpation of Corporate opportunity Standard with the Line Business Test of Delaware  as well as the Multiple Factors test and Fairness tests, concluding that Virginia has not adopted a test and thus can rely on an expert from another jurisdiction. Second, the court disagrees with the defendant that the issues are noncomplex, as his ""scientific, technical, or other specialized knowledge will assist the trier of fact"" in determining whether Defendants usurped a technology solution from Sevatec. Third, the court held that Sevatec was not required to identify Hermus' sources of information.",,2018.0,Active
101,101,"Silverman v. OpenAI, Inc.","Authors Sarah Silverman, Christopher Golden and Richard Kadrey sue OpenAI, Inc. on behalf of themselves and all persons domiciled in the United States owning copyright in any work used as training data for OpenAI's ChatGPT large language models, including GPT-3.5 and GPT-4, alleging copyright infringement, removal of copyright management information, unfair competition, unjust enrichment, and negligence.",ChatGPT,Federal: US Dist. Ct. N.D. Ca.,Generative AI,"Copyright Infringement, Negligence, Unjust Enrichment, Unfair Competition, 17 U.S.C. 1202 Removal of Copyright Management Information",Copyright Infringement,2023-07-07,7/24/2023,https://blogs.gwu.edu/law-eti/?page_id=10&pid=91,Active,,"Summary of Facts and Activity to DatePlaintiffs allege that OpenAI trained its ChatGPT large language models, include GPT-3.5 and GPT-4, with literary works that were still under copyright, without the authorization of the owners of copyright in those works, including the plaintiffs or of anyone in the proposed class of US-domiciled authors and copyright owners whose books were so used. Plaintiffs filed their complaint on July 7, 2023; the case was assigned to Judge Trina L. Thompson on July 24, 2023",Case assigned to Judge Trina L. Thompson,2023.0,Active
102,102,State of Washington v. Flanigan et al,"Defendants Flanigan et al sought discovery from Washington State Patrol for access to the Draeger machine for dynamic testing comparing the software to what the machine actually does as opposed to time-consuming static testing, the court granted discovery of the materials reasonably in possession or in control of by the State Snohomish County Prosecuting Office: two instruments and the software code under a protective order",Draeger Alcotest,"State: Washington Snohomish County Court, South County",Breathalyzer,"Discovery, Evidence, Protective Order","Admissibility, Transparency/Trade Secrecy",2015-01-01,,https://blogs.gwu.edu/law-eti/?page_id=10&pid=41,,,"Summary of Facts and Activity to DateNeed information about the four cases that were consolidated into this case in 2015In November 2015, the court granted Flanigan et al's discovery for access to two of the Snohomish County's Draeger machines for dynamic testing, as it was material and reasonable evidence.The Court on December 16th granted Draeger's Motion to Quash Subpoenas as Draeger was categorized as witness and there was no evidence that Flanigan filed appropriate actions for a witness in Texas.The court on December 17th granted a motion to modify the subpoena ad granted a protective order for the Washington State Patrol: the modified order required WSP to provide the two Draeger Alcotest to defendant experts, and under a protective order provide the software source code to defendant experts",,2015.0,Not specified
103,103,State v. Pickett,"Court of Appeals ruling that the source code must be revealed under a protective order for effective review of the reliability of the state's proprietary DNA analysis when there was not enough DNA for traditional DNA analysis to identify a criminal defendant, emphasizing the importance of independent review and the dangers of programmer bias",TrueAllele,State: New Jersey,"Criminal Justice, DNA Analysis, Intellectual Property","5th Amendment, N.J.R.E. 702, 6th Amendment","Insufficient Research, Role of Expert Testimony, Transparency/Trade Secrecy, Unreliability/Miscalculationns",2017-04-16,2/3/2021,https://blogs.gwu.edu/law-eti/?page_id=10&pid=21,Active: On Remand,"This is the first case on appeal to tackle the issue of trade secrecy in determining the reliability of forensic evidentiary technology TrueAllele in New Jersey. The solution to balancing constitutional and intellectual property rights was a protective order.The Court of Appeals highlighted True Allele’s competitor who was forced to reveal the source code in another criminal case and multiple errors were found. The court also found the need for independent review for both the judge and the defendant to independently evaluate the State's expert's testimony but acknowledged the concerns about the proprietary information getting out. The court also recognized that the data programmed might be inherently biased, thus exacerbating bias. TrueAllele is designed to evaluate cases where there are low amounts of DNA where other DNA analysis tests will not work.Many groups wrote amicus briefs highlighting the necessity for algorithmic transparency, which are excerpted in the order.","Summary of Facts and Activity to DateOn April 16, 2017, police witnessed defendant and co-defendant shoot into a crowd and flee, where police pursued and arrested them. The police picked up two handguns after retracing Pickett's path and a ski mask retracing the co-defendant's path. The forensic scientist said the small amount of DNA amylase from the saliva on the ski mask was not enough for a traditional DNA analysis but compared to swabs from the Defendant that produced results. The rest of the DNA samples did not produce any results, so the State sent it out.Hudson County Grand Jury indicted and charged defendant with first degree murder and charges relating to weapons.The State sent the samples to Cybergenetics lab in Pittsburgh who used TrueAllele to make up for the smaller samples that often result in more ""probabilistic"" analysis and ""leaves more room for interpretation than for the single-source or simple-mixture samples that have been traditionally DNA tested."" The TrueAllele program calculates likelihood that the given individual was a contributor compared to an unrelated individual to account for the effects of the smaller sample.At the Hudson County court Frye hearing in late April 2019, the State's DNA expert (and co-founder of Cybergenetics) used a software to conclude that the defendant's DNA was connected to the murder in question. After briefs and oral arguments, on June 23, 2020 the judge denied the defendant's request for discovery to this software source code and documents under trade secrecy, finding that the hearing testimony and documents were sufficient. The State's opposition brief included statements from Cybergenetics saying this software was thousands of lines long, not included in the patent because the industry is too highly competitive, and that defendant could examine parts of the source code on a specific computer after signing an NDA. The Judge's order did not engage with the reliability of the software.Defendant appealed this ruling, arguing that the source code was necessary to determine the reliability and therefore admissibility. The Court of Appeals determined that the defendant was entitled to True Allele’s source code for the purpose of challenging the reliability of expert testimony and reliance on the DNA analysis. The court found that defendant was entitled to the source code and documents because the defendant showed particularized need for this discovery: testing, design, bug reporting, change logs, program requirements, any documents needed to challenge the reliability, an example of other jurisdictions safeguarding IP with protective orders.",Court of Appeals Ruling,2017.0,Active
