,Unnamed: 0,Caption,Brief Description,Algorithm,Jurisdiction,Application Areas,Cause of Action,Issues,Date Action Filed,New Activity,Link,Status,sig_summary,ext_summary,recent_activity,Year Filed,Status_Cat
34,34,Ewert v. Canada,Canada's Supreme Court ruled that Correctional Service of Canada breached their statutory duty to take all reasonable steps to learn how the algorithms did not account for indigenous populations when an inmate argued the that the psychological and risk assessment algorithms were invalid when applied to Indigenous inmates for lack of research,,International: Canada,"Criminal Justice, Recidivism","Corrections and Conditional Release Act, S.C. 1992, c. 20, s. 24(1)","Cross Culture Validity, Insufficient Research, Socioeconomics Bias, Use of Race, Unreliability/Miscalculationns",2014-10-20,6/13/2018,https://blogs.gwu.edu/law-eti/?page_id=10&pid=7,Inactive: Judgement for P,"Canada's Supreme Court ruled that CSC breached their statutory duty when they did not take all reasonable steps to study the cross-cultural validity of the algorithm on indigenous populations. The dissent took issue with Ewert bringing this case for the use of the psychological and risk assessment algorithms on all indigenous inmates, arguing that Ewert should have just brought suit about his specific results of the algorithm since that is what the relief related to. The majority however emphasized that Indigenous inmates were less likely to be granted early release, were classified as high risk, and the tools had been developed using information from non-indigenous populations.The majority and dissent also disagreed on whether the CSC should test for accuracy (majority) or validity (dissent).The five tools Ewert challenged were: ""Hare Psychopathy Checklist-Revised (“PCL-R”), a tool that was designed to assess the presence of psychopathy but is also used to assess the risk of recidivism. Mr. Ewert also challenged the use of the Violence Risk Appraisal Guide (“VRAG”) and the Sex Offender Risk Appraisal Guide (“SORAG”), two actuarial tools designed to assess the risk of violent recidivism; the Static-99, an actuarial tool designed to estimate the probability of sexual and violent recidivism; and the Violence Risk Scale – Sex Offender (“VRS-SO”), a rating scale designed to assess the risk of sexual recidivism that is used in connection with the delivery of sex offender treatment.""","Summary of Facts and Activity to DateThe Corrections and Conditional Release Act requires the Correctional Services of Canada (""CSC"") to take ""all reasonable steps"" to ensure information is accurate and complete about an inmate. The CSC used five different risk assessment algorithmic tools to make decisions about the inmates.Ewert is an inmate serving two sentences for murder and attempted murder. Ewert is Métis. Ewert filed the first suit about these internal review tools as early as early April 2000. Ultimately, Ewert's complaint is that the tools were made based on non-Indigenous people and were less accurate for him, and that CSC was violating the law by not showing proof first that the algorithms worked on Indigenous offenders. Ewert also brought claims for his Charter rights which were rejected by the Supreme Court.The CSC made claims to Ewert that they would study indigenous populations and the five psychological and risk assessment algorithms in 2007. However, by 2015 they had still not produced any cross-cultural validity data.In 2015, the Federal Court ruled for Ewert, granting declaratory relief and an injunction for using the algorithms on himself in the future and not using any of the past algorithmic results. Ewert's expert showed that there was a research gap on the validity of the tests, and the court mandated further study.Federal Court of Appeals overruled, finding Ewert did not show enough evidence of ""false results and conclusions"" and thus was not entitled to the injunction and research mandate.The Supreme Court on June 13, 2018 ruled for Ewert, holding that CSC had not taken reasonable steps to ensure and prove that its psychological and statistical algorithms that make decisions about Indigenous inmates are effective. The majority cites to facts that indigenous offenders are less likely to be granted early release, and classified as higher risk than non-indigenous inmates. The majority also points to CSC using the tools even with concerns. However, the Supreme court decision did not reinstate the injunction that the court of appeals overruled.The dissent disagreed on the definition of ""information"" about inmates to be the factual information and biographical information, and that CSC only needed to keep accurate records of the results of the tools. The dissent proposed that Ewert should have appealed the specific decisions the algorithm made about him rather than saying the whole algorithm did not take into account indigenous offenders.",Supreme Court Judgement,2014.0,Decided
35,35,"Faridian v. DoNotPay, Inc.","A DoNotPay consumer filed a class action lawsuit earlier this month in a California state court, alleging that the company violated California’s unfair competition law by holding itself out as a lawyer and engaged in the unauthorized practice of law by providing legal services without a law license. Jonathan Faridian claims that he used the company’s document drafting services under the belief that he was “purchasing legal documents and services that would be fit for use from a lawyer that was competent to provide them.” But many of the documents provided by DoNotPay were allegedly unusable as they included details that were inaccurate based on the information provided by Faridian. In one instance, the documents provided by DoNotPay were completely blank and were never delivered to the opposing party, Faridian alleges.",,US District Court for the Northern District of California,"Advertising, Fraud, Generative AI, Legal Research",Unfair Competition,"Unaware of Use of Algorithm, Reliability",2023-03-03,1/30/2024,https://blogs.gwu.edu/law-eti/?page_id=10&pid=119,Active,"A question here is whether DoNotPay’s use of artificial intelligence pushes this service beyond the mere provision of forms and general information and into the realm of legal advice. And whether the result would be any different if unlicensed humans provided the services instead of AI.Courts and regulators have consistently refused to accept AI as an author or creator of anything from a patent and copyright perspective. How does that perspective factor into a situation where AI is accused of giving legal advice? In this situation, it would make more sense to look at what DoNotPay is doing, rather than focus on whether humans or AI are doing it.","Summary of Facts and Activity to DateOn March 3, a class action was filed in the Superior Court of California, San Francisco County, by Jonathan Faridian as the named plaintiff against DoNotPay, claiming the defendant engaged in ""unlawful, unfair, and/or fraudulent business practices"" in violation of California's Unfair Competition Law.[6]The complaint highlights DoNotPay's display of the slogan, ""The World's First Robot Lawyer,"" on its website, along with snapshots marketing other services such as ""Defamation Demand Letters,"" ""Create a Power of Attorney,"" and ""Sue Anyone in Small Claims Court"" and a clickable button marked ""Solve This Problem For Me.""It alleges that, although ""DoNotPay is not a lawyer or law firm,"" the website ""offers customers the ability to purportedly hire a lawyer at the click of a button to handle a variety of legal matters,"" and that Faridian in fact ""believed he was purchasing legal documents and services that would be fit for use from a lawyer that was competent to provide them.""Faridian further alleges that the services provided to him ""were substandard and poorly done.""In short, the Faridian complaint focuses on the ""lawyer"" part of ""World's First Robot Lawyer"" and claims that, although DoNotPay holds itself out as one, it is not, in fact, a lawyer.The case is removed the SuperiorCourt of the State of California for the County of San Francisco to US District Court for the Northern District of California on April, 7th, 2023.",Motion Hearing AND Order on Motion for Miscellaneous Relief,2023.0,Active
36,36,"Federal Trade Commission v. Kochava, Inc.","The Federal Trade Commission filed a lawsuit against data broker Kochava Inc. for selling geolocation data from hundreds of millions of mobile devices that can be used to trace the movements of individuals to and from sensitive locations. Kochava’s data can reveal people’s visits to reproductive health clinics, places of worship, homeless and domestic violence shelters, and addiction recovery facilities. The FTC alleges that by selling data tracking people, Kochava is enabling others to identify individuals and exposing them to threats of stigma, stalking, discrimination, job loss, and even physical violence. The FTC’s lawsuit seeks to halt Kochava’s sale of sensitive geolocation data and require the company to delete the sensitive geolocation information it has collected.",,"District Court, D. Idaho","Health, Personal Injury, Privacy, Social Media","FTC Act, Permanent Injunction, Unfair and Deceptive Practices, Unfair and Deceptive Trade Practices",Privacy,2022-08-29,2/3/2024,https://blogs.gwu.edu/law-eti/?page_id=10&pid=128,Active,"Coming in the wake of the agency’s warning of a coming crackdown on commercial surveillance, this action reveals much about the agency’s stance toward data broker collection of consumer data, and geolocation data in particular. With this action, and the advance of the FTC’s ambitious commercial surveillance rulemaking effort,2 companies may be in for greater challenges over their use and sharing of consumer data.","Summary of Facts and Activity to DateOn August 29, 2022, the agency had filed suit against Kochava in the U.S. District Court for the District of Idaho for its alleged unlawful sales of precise geolocation data from hundreds of millions of mobile devices.As a marketing data broker, Kochava allegedly collects information about consumers, including data collected from hundreds of millions of consumer mobile devices. The FTC alleges that Kochava sells this information to its clients in customized data feeds that match unique mobile device identification numbers with timestamped latitude and longitude locations. Kochava allegedly made this data available to clients for a monthly subscription fee, along with a free sample, enabling clients to improve their advertising with analysis of foot traffic, user demographics, and other measurements.According to the FTC, Kochava’s sales of tracking data, or “sensitive geolocation data,” enabled the identification of individuals, “exposing them to threats of stigma, stalking, discrimination, job loss, and even physical violence.”The FTC’s complaint singles out Kochava’s alleged lack of technical controls to prevent identification of customers, pointing out that the company could have used a blacklist to remove or obfuscate location signals around sensitive locations within data setsWith this lawsuit, the FTC seeks to halt Kochava’s sale of sensitive geolocation data, and delete the sensitive geolocation data it has collected so far.On May 4, 2023, an Idaho federal judge dismissed the lawsuit and ruled that the Federal Trade Commission (FTC) needs stronger assertions of consumer harm in order for its data privacy suit against Kochava to proceed. The court simultaneously found no basis for Kochava’s suit to block the FTC’s enforcement action. The judge sided with Kochava’s argument that the agency had not adequately supported its claim that the company sales of geolocation data constituted unfair conduct under Section 5 of the FTC Act, finding no allegations that the practices “created a ‘significant risk’ of concrete harm.” The court gave the FTC the opportunity to refile. The FTC submitted a new complaint in June, 2023. Kochava requested that the court keep the amended complaint under seal, which it did until it could rule on the merits of the parties’ arguments.On November 3, 2023, the court granted the FTC’s motion to unseal the amended complaint, finding no “compelling reason” to keep the amended complaint under seal and rejecting Kochava’s arguments that the amended complaint’s allegations were “knowingly false” or “misleading.” As a result, the FTC’s amended complaint has been unsealed to the public.In all, the amended complaint generally alleges Kochava “sells data in several different forms” in its mobile data marketplace and that “Kochava uses records of consumers’ precise geolocation over time to categorize consumers into audience segments and then sell lists of consumers to others with promises that the details revealed by consumers’ movements will assist the third parties to identify and target individual consumers.”  All of this is done, according to the FTC, “without consumers’ knowledge or consent.”Kochava has claimed that many of the allegations in the amended complaint are misleading or are otherwise foreclosed by Kochava’s subsequent implementation of a Privacy Block feature following the FTC’s initial investigation.",Memorandum Decision and Order on Motion to Dismiss First Amended Complaint,2022.0,Active
37,37,"Flora v. Prisma Labs, Inc.","In Flora v. Prisma Labs, the plaintiffs allege Prisma failed to meet all of the Illinois Biometric Privacy Act (BIPA)’s procedural requirements before collecting Lensa users’ selfies, pulling their facial geometry information from those images, and training the model on those geometries to output personalized avatars.",,US District Court for the Northern District of California,"Biometric Data, Facial Recognition, Generative AI","Illinois Biometric Information Privacy Act, Unjust Enrichment","Facial Recognition, Failure to Disclosure, Personally identifiable Information, Unaware of Use of Algorithm",2023-02-15,8/8/2023,https://blogs.gwu.edu/law-eti/?page_id=10&pid=121,Active,"With Artificial Intelligence-generated portraits widely trending in social media, an Illinois class action lawsuit charges Prisma Labs, the company known for its Lensa smartphone app and AI art, with unlawfully collecting Illinois residents’ biometric data through their “Magic Avatars” AI-generated art. The Lensa app has been downloaded by millions and the “Magic Avatars” function used and shared by everybody from basketball stars to celebrities.Today’s class action lawsuit also highlights concerns from artists that the Lensa-created “magic avatars”—which use the open-source AI model Stable Diffusion that trained on 2.3 billion captioned images from the internet—violate the copyrights of art they have posted online. The suit further alleges that despite Lensa’s Terms of Use mandating a “no nudes” policy, the app would generate nudes from images containing nothing but headshots or fully-clothed images.","Summary of Facts and Activity to DateIn February 2023, plaintiffs filed suit against Prisma Labs, Inc., developer of the photo-editing app Lensa, alleging that the company violated the Illinois Biometric Information Act (BIPA) by purportedly storing Lensa users’ facial geometries without their consent. First, they allege Prisma violated section 15(a), requiring Prisma to develop a written policy establishing a schedule to destroy biometric data after a certain time; they allege Prisma violated section 15(b) for collecting user’s biometric data without first notifying the user in writing of the purpose and length of collect and receiving a written release form; they also allege violations of sections 15(c) by profiting off of biometric data collected to improve Lensa, 15(d) by transferring users’ biometric data to third-party cloud servers without disclosing this and receiving user consent, and 15(e) for failing to store user’s biometric data in a way that meets the industry standard of care. Importantly, the Flora plaintiffs rely heavily on the version of Prisma’s Privacy Policy that was in place when they downloaded the app in early December 2022. According to them, the wording of that policy was vague with the terms it used to describe the facial information Lensa collects, never using the terms “facial geometry” or “biometric” despite using the term “face data” in a separate part of the Policy (after claiming the company does not collect such data).The Flora plaintiffs also suggest that Prisma’s Privacy Policy states the company deletes users’ biometric data (gleaned from their uploaded selfies) within 24 hours of creating the avatars. But this claim by Prisma is spurious, as the ML community is still trying to understand the extent to which models memorize training data in ways that make it impossible to delete or remove that data from the ultimate models.In June, Prisma moved to compel arbitration on the ground that the plaintiffs had agreed to Lensa’s Terms of Use which provided that “all disputes arising out of or relating to these Terms or Lensa will be resolved through confidential binding arbitration.”  In opposing Prisma’s motion, the plaintiffs argued that the arbitration agreement was unconscionable.  The court rejected that argument.According to the court, the arbitration agreement, which was clearly written and labeled within the Terms of Use and provided users with the opportunity to opt out of binding arbitration, was not procedurally unconscionable.  Therefore, because “both procedural and substantive unconscionability must be present in order for an agreement to be enforceable,” the court did not address the question of whether the arbitration agreement was also substantively unconscionable.Despite rejecting the plaintiffs’ unconscionability argument, the court did agree with their argument that the arbitration agreement’s forum selection clause conflicted with the Judicial Arbitration and Mediation Services’ (JAMS) Consumer Minimum Standards by not providing users with the right to arbitrate in their home state.  According to the court, this rendered the agreement’s forum selection clause impermissibly illusory because of the possibility that JAMS might refuse to arbitrate the dispute based on the agreement’s failure to meet JAMS’ minimum standards.  Nevertheless, the court found the illusory forum selection clause severable.  Accordingly, the court severed the clause and compelled arbitration.",Order on Motion to Compel,2023.0,Active
38,38,Flores v. Stanford,Action claiming that parole procedures violate due process because they are based in part on risk assessment algorithms and do not involve the assessment of individual files,,"Federal: U.S. District Court, S.D. New York","Criminal Justice, Detention and Release",Due Process,"Individualized Assessment, Lack of Human Review",2018-03-20,4/11/2022,https://blogs.gwu.edu/law-eti/?page_id=10&pid=68,Active,The plaintiffs will have access to COMPAS and examine whether the programming holds young offenders' ages against them by treating youth as an aggravating factor in various ways and thus discriminates against them in the parole hearing.,"Summary of Facts and Activity to DateThis is a class action against the New York State Board of Parole. Each plaintiff was convicted by a New York State court of committing homicide as a juvenile. Each received an indeterminate prison sentence up to a maximum term of life with the possibility of parole, to be served in the custody of theNew York State Department of Corrections and CommunitySupervision (“DOCCS”). The Board assigns a “lead” commissioner for each parole interview. During the interview, only that lead commissioner has acomplete copy of the offender's parole file. Non-lead commissioners allegedly receive only a partial, “book copy” of the offender's file, one of which is “COMPAS report”—areport applying Correctional Offender Management Profiling for Alternative Sanctions (“COMPAS”), which DOCCS allegedly uses as a predictive risk assessment tool.The plaintiffs argue COMPAS holds young offenders' ages against them by treating youth as an aggravating factor in various ways. They seek to have access to COMPAS as the part of the discovery.On February 2nd, 2023 the court ordered that the parties should discuss settlement in good faith and as of May 5th, 2023 the parties have still been in mediation.",Order for good faith settlement,2018.0,Active
39,39,Force v. Facebook,"Suit dismissed against Facebook and cert denied by the Supreme Court, plaintiffs arguing that Facebook's algorithm suggests friends and groups based on similar interests, and highlights popular posts the user would like, and thus Facebook was providing the terrorist organization Hamas with means to reach an audience it would not otherwise have access to.",,Federal: US Dist. Ct. S.D. New York; Transferred to E.D.N.Y.,"Advertising, Social Media, Terrorism","Antiterrorism Act, Section 230","Lack of Remedy, Targeted Advertising",2016-07-10,5/18/2020,https://blogs.gwu.edu/law-eti/?page_id=10&pid=45,Inactive: cert denied,"The 2nd Circuit Dissent is the most important part of this case, which would have held Facebook liable for its algorithms and not immunized under Section 230: ""After collecting mountains of data about each user's activity on and off its platform, Facebook unleashes its algorithms to generate friend, group, and event suggestions based on what it perceives to be the user's interests. Id. at 345-46 ¶¶ 608-14. If a user posts about a Hamas attack or searches for information about a Hamas leader, Facebook may ""suggest"" that that user become friends with Hamas terrorists on Facebook or join Hamas-related Facebook groups. By ""facilitating] [Hamas's] ability to reach and engage an audience it could not otherwise reach as effectively,"" plaintiffs allege that Facebook's algorithms provide material support and personnel to terrorists. Id. at 347 ¶ 622; see id. at 352-58 ¶¶ 646-77. As applied to the algorithms, plaintiffs' claims do not seek to punish Facebook for the content others post, for deciding whether to publish third parties' content, or for editing (or failing to edit) others' content before publishing it. In short, they do not rely on treating Facebook as ""the publisher"" of others' information. Instead, they would hold Facebook liable for its affirmative role in bringing terrorists together.""","Summary of Facts and Activity to DatePlaintiffs filed their complaint on July 10, 2016, stating that Facebook uses algorithms to collect data and then ""actively"" suggest friends and groups to users, and ""actively"" promote posts that the user might like. Additionally, Facebook's uses targeted advertising. The complaint argues that Facebook allowed Hamas to reach and engage with the audience it would not have otherwise been able to effectively reach, and thus resulted in terrorist attacks.The amended complaint after the case was transferred to EDNY asserts this case concerns Section 230, and that Facebook violated the Anti-Terrorism Act by providing ""material support"" to Hamas through their algorithms. The amended complaint adds that Facebook had the power to flag, review and remove these Hamas accounts.The court granted Facebook's motion to dismiss because the claims were against Facebook in its publisher/speaker role under Section 230, and denied Force's motion to alter judgement and allow a second amended complaint. The reasoning:In July 2019, the Second Circuit affirmed that Section 230 immunized Facebook. The majority also rejected foreign law claims. Interestingly, Chief Judge Katzmann dissent in part to say that Section 230 did not immunize against these certain alleged actions of bringing terrorists together. The Second Circuit denied rehearing on August 29, 2019.Supreme Court denied certiorari on May 18, 2020.",Supreme Court Denied Cert,2016.0,Inactive
