,Unnamed: 0,Caption,Brief Description,Algorithm,Jurisdiction,Application Areas,Cause of Action,Issues,Date Action Filed,New Activity,Link,Status,sig_summary,ext_summary,recent_activity,Year Filed,Status_Cat
57,57,"Inkie Lee v. Tesla, Inc.","A class action lawsuit accuses Tesla of selling vehicles with a defect that causes unexpected and dangerous acceleration. Numerous plaintiffs have lodged their claims in the Tesla class action lawsuit, arguing the Model X, Model S and Model 3 can accelerate suddenly without the driver’s doing. The defect allegedly produces full power and acceleration, even if the driver is not pressing the acceleration pedal.",Autopilot,"District Court, C.D. California",Autonomous Vehicles,"Breach of Contract, Breach of Implied Warranty, Express Warranty Breach, False Advertising, Magnusson-Moss Warranty Act, Unfair Competition","Product Liability, Underperformance",2020-01-20,10/1/2020,https://blogs.gwu.edu/law-eti/?page_id=10&pid=126,Inactive,"According to the plaintiffs, the integrated electronic hardware and operating software of Tesla’s 2013-2020 Model S, 2016-2020 Model X, and 2018-2020 Model 3 all suffer from a defect which causes the unexpected acceleration.This case is not alone; the issue was reportedly exposed in a high profile case where a Tesla Model 3 accelerated suddenly, ran off a public highway and struck an office building – killing an office worker in the impact.In another incident, consumer Hacene Djemil was trying to park his car and reportedly ended up ramming across the parking lot into the wall of a Subway restaurant. Djemil claims that the car accelerated without his input, resulting in serious injuries to his wife and children. The plaintiffs say they have also had similar experiences.","Summary of Facts and Activity to DateThe suit, which was first filed in January on behalf of eight Tesla vehicle owners in five states, was expanded in July to include 23 named plaintiffs in 11 states alleging Tesla's Model S, Model X and Model 3 electric vehicles contained a ""sudden uncommanded acceleration"" defect.The plaintiffs contend they have ""empirical and anecdotal evidence"" indicating that the integrated electronic hardware and operating software of Tesla's 2013-2020 Model S, 2016-2020 Model X and 2018-2020 Model 3 all suffer from the acceleration defect.The allegations stem from a preliminary review the National Highway Traffic Safety Administration launched in January after receiving a petition requesting a formal investigation into complaints that as many as 500,000 Tesla vehicles contained a defect that can cause sudden unintended acceleration, which may result in crash and injury.The named plaintiffs are seeking to represent a nationwide class as well as classes of drivers in California, Arizona, Florida, Georgia, Massachusetts, New Jersey, North Carolina, Oregon, Pennsylvania, Texas and Washington.Tesla's motion seeks to dismiss the claims of all but one each of the California, Arizona and Texas plaintiffs, and the only plaintiffs named in New Jersey and Massachusetts.Tesla argued that the plaintiffs named in the motion agreed to arbitrate their claims either through signed agreements or through an online process. The company argues the arbitration agreements were clearly outlined with fair, reasonable terms that would not qualify as being unconscionable.Tesla also argued that the arbitration agreements are meant to benefit the customers by being ""designed to ensure that Tesla's customers have a simple and efficient means of resolving disputes"" with the company.The District Court of Central District of California grants in part Telsa's Motion to Compel. For the residents of California listed in Tesla’s motion to compel, the Court compels arbitration of their individual claims but declines to compel arbitration of their requests for public injunctive relief. For the residents of Arizona, Florida, Georgia, Oregon, Pennsylvania, Texas, and Washington listed in Tesla’s motion to compel, the Court compels arbitration of all their claims. The Court also STAYS the proceedings for all parties pending the binding arbitration.",Order Regarding Defendant Tesla's Motion to Compel Arbitration,2020.0,Inactive
58,58,"John v. Clearview AI, Inc.","Class transferred and consolidated into In re Clearview, complaint charged that Clearview violated BIPA, Cal. UDAP (unfair), Cal. right to publicity, Cal. Const. privacy, interference with K with social media companies, and unjust enrichment and sought seeking injunctive relief, damages, restitution, disgorgement, and litigation costs",Clearview,Federal: US Dist Ct. S.D. New York; Transferred to US Dist. Ct. N.D. Illinois,Facial Recognition,"BIPA, Contracts, Right to Privacy, UDAP, Right to Publicity, Unjust Enrichment",Privacy,2020-05-04,1/12/2021,https://blogs.gwu.edu/law-eti/?page_id=10&pid=24,Active,"The fifth of the six New York cases consolidated under MDL, this case was brought after Judge McMahon's April 22 Directive regarding Calderon, Broccolino, Burke, and Roberson.Of the class, there are four subclasses: Nationwide, Illinois, New York, and California. John is from New York, Balfanz is from California, and Jais and the rest of the class are from Illinois. This is the first action where the class is from three or more states.The complaint emphasizes Clearview's lack of data security on top of its violation of privacy.","Summary of Facts and Activity to DateThe complaint is brought in SDNY against Clearview and its cofounders Hoan Ton-That and Richard Schwartz for violating BIPA. Like other complaints, complaint emphasizes Clearview's marketing of its proprietary facial recognition technology, and its paid contracts with ICE, foreign governments, and fitness, retail and entertainment companies.Judge McMahon ordered a statement of relatedness to Calderon, which was filed on May 5, 2020, finding that the SDNY cases and Illinois case 1. concern the same or substantially similar parties, transactions and events, 2. the facts substantially overlap, 3. the parties could get conflicting orders and 4. there would be duplication of effort and expense on the court, parties and witnesses if there is not a determination of relatedness.The six New York cases were stayed by Judge McMahon on September 9 pending a decision on MDL.On January 12, 2021, the case was transferred to the Northern District of Illinois. Assigned Case Number 1:21-cv-00173.",MDL Transferred out,2020.0,Active
59,59,"Justine Hsu v. Tesla, Inc.","Justine Hsu, a resident of Los Angeles, sued the EV maker in 2020, saying her Tesla Model S swerved into a curb while it was on Autopilot and then an airbag was deployed ""so violently it fractured Plaintiff's jaw, knocked out teeth, and caused nerve damage to her face.” Hsu alleged negligence, fraud and breach of contract in her 2020 suit. Tesla denied liability for the 2019 accident. Tesla was found by a Los Angeles jury not to be at fault following a trial.",Autopilot,Los Angeles County Superior Courts,"Advertising, Autonomous Vehicles, Generative AI","Breach of Contract, Breach of Implied Warranty, Common Fraud, Express Warranty Breach, Failure to Warn, Fraud, Implied Warranty Breach, Intentional Torts, Negligence, Product Liability","Product Liability, Underperformance",2020-05-14,5/30/2023,https://blogs.gwu.edu/law-eti/?page_id=10&pid=132,Inactive,The verdict gives the electric-car maker a victory in what appears to be first such case to go to trial amid years of controversy over the safety record of its assisted self-driving feature and continuing federal probes into whether Autopilot has defects.,"Summary of Facts and Activity to DateThe plaintiff, Justine Hsu, was driving her Tesla in stop and go traffic on a surface street with a concrete median in Arcadia, California. She activated Autopilot, a suite of features that includes “traffic aware cruise control,” a system that automatically adjusts speed based on traffic conditions and that is, according to her complaint, popular among Tesla owners in heavy traffic. The car was driving about 20-30 miles per hour when it suddenly swerved off the road and into the median. At this point the car’s airbag deployed, shattering Hsu’s jaw and knocking out several of her teeth. (The airbag manufacturer was also a defendant in the case, and was also found not liable by the jury).Hsu filed in Los Angeles County Superior Courts on 5/14/2020. Hus sued Telsa for negligence, fraud and breach of contract.Hsu said in her lawsuit that the Tesla Model S she was driving had Autopilot engaged when it turned into and hit a median on a city street. Airbags deployed fracturing her jaw and causing nerve damage.Tesla argued that Hsu didn’t follow instructions in the manual for her 2016 Model S that the driver must be in control of the car at all times and not to use the “auto steer” function on city streets. When her car crashed, it went through an intersection and her lane shifted to the right. Hsu didn’t have her hands on the steering wheel and she failed to correct the course of the car, Tesla said.Following a three-week trial, the jury ruled Tesla wasn't to blame in the $3 million lawsuit. According to the jury, the airbags were not defective and they performed safely as intended, and Autopilot did not malfunction as alleged by the plaintiff. In addition, the jury agreed that Tesla was clear that Autopilot is to assist a driver and does not make the car self-driving.In the end, Hsu received nothing for damages as the jury said distracted driving was the cause of the crash and injuries.",Jury Verdict,2020.0,Inactive
60,60,K.W. v. Armstrong,"Class action reached a settlment after the ACLU of Idaho sought injunctive relief against the Department of Healht and Welfare cutting disabilities services because of a trade secret algorithm, resulting in development of new ADS (algorithmic decision system) to calculate disabilities benefits, litigation ensues to define the scope of the settlement",,Federal: US Dist. Ct. D. Idaho,"Agency Budget, Constitutional Law, Disabilities Benefits, Health","42 C.F.R. § 431.210(b) Medicaid Adequate Notice, Preliminary Injunction","Assigned Budget Amount, Lack of Remedy, Transparency in Change of Algorithm, Transparency/Trade Secrecy",2012-01-18,3/24/2021,https://blogs.gwu.edu/law-eti/?page_id=10&pid=5,Active,"Idaho Department of Health and Welfare program, the DD Waiver Program, had a change in formula to calculate the dollar value amount each adult patient with physical or intellectual disabilities would receive in Medicaid services led to severe drop for in-home care and services. The IDHW began building the budget tool by collecting 2009 and 2010 data for 3,500 patient records, but 66% of the sample size was discarded for various errors including missing information. The Court concluded that this formula resulted in 10-15% of patients receiving inadequate budgets, and 62% of the budgets were reconsidered after Independent Assessment Providers who are contracted by the state, so regular testing must be conducted on the formula.The Individual Assessment Provider contracted by IDHW would determine the level for factors such as type of disability and need for nursing and living services, level of hearing, vision and mobility, and then enter into the algorithm. The IAP then carries over this data to categories in the Individualized Budget Calculation, and from there the budget tool automatically calculates what Medicaid would need to pay for these needs. The budget has a standard dollar figure for each item called the ""constant"" which increases or decreases based on the IAP's evaluation, to total the Assigned Budget Amount. The Care Manager then approves the budget if it is deemed to meet the patient's needs. While disputed, the court concluded that the Service Plan Notice contains an attachment that includes copies of the IBC and the Inventory of Individual Needs for that participant, what services the Care Manager approved and denied, and the right to appeal this decision. However, the patient has 28 days to appeal to a hearing officer who can affirm or remand the decision back to the care manager, but the hearing officer themselves cannot modify the budget.Idaho's automated decision-making system algorithm was initially not disclosed as a trade secret, the ACLU succeeded in disclosure of the formula. Once the court determined the formula was ""unconstitutionally arbitrary"" it forced the Medicaid program to reconfigure its automated decision-making system so that the patients received the proper dollar value services, as well as restore the dollar value services the patients previously received before the drop in the ADS. Another important requirement is that the State Medicaid program must evaluate the new ADS formula regularly to ensure no severe drops occur like this again. The settlement negotiations are still in litigation, with the state requesting an extended timeline and scope to make these changes. It is also important to note that the court left the onus on the Medicaid program to fix the formula, but it would need support and assistance from outside firms and from the impacted patients.The settlement addressed the class three concerns: 1. the need for an accurate budget tool, 2. revising the budget notice to inform participants more clearly about changes to their budgets, and 3. aid with appeals. The settlement acknowledged the costs of developing a new budget tool by setting a deadline of two years and provided cushion for plaintiffs in that they retained their 2011 level of benefits in the meantime. After the January 2020 deadline passed, IDHW requested until January 2023 to implement structural changes and creating the new budget tool, but the court set a short-term deadline for the creation of a new budget tool because the restructuring delay is not an identical delay for the creation of a new budget tool that was promised in the 2017 settlement.Importantly, the settlement provided that the public would have the right to inspect and copy the data ""about the IDHW’s budget setting methodologies, models, and tools"" and particularly DD Waiver program participants would have the right to inspect past, present, and future information, all with redaction only when necessary to protect PII.The settlement agreed that a permanent injunction was not necessary.","Summary of Facts and Activity to DatePlaintiffs filed complaint on January 18, 2012. They brought class claims and individual claims: the class claims challenge the budget tool, the lack of notice, and the exclusion from hearings on this new tool, while the sixteen named plaintiffs bring individual claims that the change to the algorithm lead to a significant risk of them being institutionalized.injunction restored the Plaintiffs’ budgets to the levels they were at prior to July 1, 2011, the date IDHW sent the unconstitutional budget notices. The injunction also prohibited IDHW from reducing Plaintiffs budgets until it (1) provided Plaintiffs with notices, approved by this Court, and (2) made available for copying specified documents it used to calculate Plaintiffs’ budgets.The Ninth Circuit affirmed the injunction on June 5, 2015, agreeing that court approval of a proper notice that explains the budget reductions are necessary.On March 28, 2016, the District Court awarded plaintiffs’ attorneys fees for establishing the record. The court then considered cross-motions for summary judgement on both class and individual claims, motions to strike, as well as a joint motion for preliminary approval of a settlement.disclosure of formula, finding formula unconstitutional and require new formula, -- so this was reported in later orders but i can't find the initial order so i don't have the exact datesThe parties reached a preliminary settlement on the class action claims in October 2016, requiring IDHW to 1. develop a new budget tool within two years, and 2. retain plaintiffs’ benefits at their 2011 level until the new budget tool was approved. The settlement provided that if the budget tool were not implemented in three years by January 2020, the plaintiffs could ask the court to set a ""reasonable deadline"" for IDHW. The court approved the proposed notice of this settlement by sending a copy to each class member, each class member's guardian, support programs, and advocacy programs. The court granted the joint motion for preliminary approval of the settlement for the class action claims but denied approval of the revised budget because it required the class members can comment on the budget before it could be approved. Additionally, the settlement did not account for the individual claims made by the 16 named plaintiffs, called the Olmstead claims.In September 2017, the court denied IDHW's motion to dismiss the Olmstead individual claims on the grounds that they are moot with the class action settlement, but the Court disagreed and ordered that once the new budget tool is released, trial will be set for the individual claims as the settlement did not grant all the relief that the plaintiffs sued for.After the deadline for a new budget tool and restructuring passed, plaintiffs requested 120 days for IDHW to implement the new budget tool, whereas IDHW requested until January 2023 in order to implement: (1) redefine the supported living service and restructure how supports are paid; (2) developing habilitation and prevocational services; (3) improving the person-centered planning process; and (4) restructuring medical transportation. On June 4, 2020, the court granted in part plaintiff's motion to enforce judgement and defendant's motion to set reasonable deadlines by setting up a two-track deadline system: ""longer deadline for the restructuring of services and the other track being a shorter deadline for creation of the new budget tool."" The court granted the defendant's other two motions for COVID-19 relief and to allow sur-reply brief.Most recently, on November 24, 2020, the district court concurred with Plaintiffs of the need to resolve the ongoing dispute for a proper schedule for settlement but decided further mediation would only prolong complications and instead ordered a hearing to set a briefing schedule.","Strike filed, attorneys hosted Zoom update for members of the class action: http://ourhealthandwelfare.org/news/2021/3/24/latest-updates-about-kw-v-armstrong",2012.0,Active
61,61,"Kadrey v. Meta Platforms, Inc.","Authors Richard Kadrey, Sarah Silverman, and Christopher Golden sue Meta Platforms on behalf of themselves and all persons domiciled in the United States owning copyright in any work used as training data for the LLaMA language models, alleging copyright infringement, removal of copyright management information, unfair competition, unjust enrichment, and negligence.",LLaMA,Federal: US Dist. Ct. N.D. Ca.,Generative AI,"Copyright Infringement, Unjust Enrichment, Unfair Competition, 17 U.S.C. 1202 Removal of Copyright Management Information",Copyright Infringement,2023-07-07,1/16/2024,https://blogs.gwu.edu/law-eti/?page_id=10&pid=90,Active,"The court's November 20, 2023 dismissal of all but one of the plaintiffs' claims undermines some of the theories on which copyright owners are challenging the use of their works as training data for generative AI models.  The court dismissed the claims of negligence, unjust enrichment, and unfair competition as preempted by copyright law on the facts alleged, and although it left open the possibility that the plaintiffs could amend their complaint to assert other facts about unjust enrichment and unfair competition, it is unlikely that the plaintiffs will be able to do so. The court also dismissed the plaintiffs' DMCA copyright management information claim, concluding that there was no allegation that the defendants distributed copies of plaintiffs' works, with or without their copyright management information.  Finally, the court dismissed two theories involving derivative works.  It held that the defendant's generative AI model was not itself derivative of the plaintiff's works, and also that the works that the model generated could not be called derivative of the plaintiffs' works without their being substantial similarity between the two.","Summary of Facts and Activity to DatePlaintiffs allege that Meta Platforms trained its large language model LLaMA with data that included ""the Books3 section of The Pile,"" which is compiled by an organization called EleutherAI.  Books3 is allegedly derived from a collection of 196,640 books on a website called ""Bibliotik."" That collection includes many books that are still under copyright, including books written by the individual plaintiffs.  Plaintiffs' claims arise out of Meta's use of those books to train LLaMA without the authorization of the plaintiffs or of anyone in the proposed class of US-domiciled authors and copyright owners whose books were so used.  Plaintiffs filed their complaint on July 7, 2023.  On November 20, 2023, Judge Vince Chhabria granted Meta's motion to dismiss all claims other than the claim that the unauthorized copying of the plaintiffs’ books for purposes of training LLaMA constitutes copyrightinfringement.","Administrative Motion to determine if  the Kadrey proceeding should relate to the Huckabee, et al. v. Meta Platforms, Inc., et al. proceedings.",2023.0,Active
62,62,Kisting-Leung v. Cigna Corp.,"Plaintiffs, consumers in California, filed a class action complaint alleging that the denial of certain medical claims by a national health insurance company using an algorithm constituted breach of the implied covenant of good faith and fair dealing, unjust enrichment, intentionally interfered with contractual relations, and violated California’s Unfair Competition Law. Wrongful claims denials can result in patients having to pay substantial out-of-pocket costs or even forgoing important procedures.",,US District Court for the Eastern District of California,"Civil Rights, Health","Breach of Contract, Contracts, Unjust Enrichment, Unfair Competition","Accountability, Individualized Assessment, Lack of Human Review, Lack of Remedy, Misuse of AI",2023-07-24,12/18/2023,https://blogs.gwu.edu/law-eti/?page_id=10&pid=113,Active,"The litigation highlights the growing use of algorithms and artificial intelligence to handle tasks that were once routinely handled by human workers. At issue in health care is whether a computer program can provide the kind of ""thorough, fair, and objective"" decision that a human medical professional would bring in evaluating a patient's claim.","Summary of Facts and Activity to DateThe suit, which was filed in the US District Court for the Eastern District of California on July, 24th, 2023, and is seeking class action status, was brought forth by a pair of plaintiffs who were denied coverage by Cigna. One plaintiff, Suzanne Kisting-Leung, was referred for an ultrasound because of a suspected risk of ovarian cancer. Another, Ayesha Smiley, had been tested for a vitamin D deficiency at the order of her doctor.The health insurer’s digital claims system, called PXDX, is an “improper scheme designed to systematically, wrongfully, and automatically deny its insureds medical payments owed to them under Cigna’s insurance policies,” the complaint alleges.After the lawsuit was filed Monday, Cigna defended the software system. “PXDX is a simple tool to accelerate physician payments that has been grossly mischaracterized in the press,” spokesperson Justine Sessions said in a statement. “The facts speak for themselves, and we will continue to set the record straight.”",Plaintiff filed second amended complaint,2023.0,Active
